{
  "$schema": "https://json-schema.org/draft/2020-12/schema",
  "$id": "https://ai-compiled-towerdefense.local/schemas/world_state_delta_transaction.v0.1.schema.json",
  "title": "WorldStateDeltaTransaction v0.1",
  "description": "Transaction wrapper for an existing WorldStateDelta v0.1. It records source intent, preconditions, operation mapping, conflict policy, rollback policy, and validation status without replacing or extending the delta schema. It must never contain a generic effects[] list that could bypass the controlled operations[] whitelist.",
  "type": "object",
  "additionalProperties": false,
  "required": [
    "schema_version",
    "transaction_id",
    "run_id",
    "worldbook_id",
    "actor",
    "source",
    "created_turn",
    "created_at",
    "base_world_version",
    "idempotency_key",
    "scope",
    "source_refs",
    "world_state_delta_ref",
    "preconditions",
    "operation_effects_mapping",
    "conflict_policy",
    "rollback_policy",
    "validation_report",
    "status"
  ],
  "properties": {
    "schema_version": {
      "type": "string",
      "const": "world_state_delta_transaction.v0.1"
    },
    "transaction_id": { "type": "string", "minLength": 1 },
    "run_id": { "type": "string", "minLength": 1 },
    "worldbook_id": { "type": "string", "minLength": 1 },
    "actor": {
      "type": "string",
      "enum": ["player", "system", "developer", "publisher"]
    },
    "source": {
      "type": "string",
      "enum": ["battle_result", "research_job", "narrative_event", "system"]
    },
    "created_turn": { "type": "integer", "minimum": 1 },
    "created_at": {
      "type": "string",
      "pattern": "^\\d{4}-\\d{2}-\\d{2}T\\d{2}:\\d{2}:\\d{2}(\\.\\d+)?(Z|[+-]\\d{2}:\\d{2})$"
    },
    "base_world_version": { "type": "string", "minLength": 1 },
    "idempotency_key": { "type": "string", "minLength": 1 },
    "scope": {
      "type": "object",
      "additionalProperties": false,
      "required": ["kind", "node_ids", "object_refs", "state_fields"],
      "properties": {
        "kind": {
          "type": "string",
          "enum": ["battle_result_commit", "research_commit", "narrative_stage_commit", "system_commit"]
        },
        "node_ids": {
          "type": "array",
          "items": { "type": "string", "minLength": 1 }
        },
        "object_refs": {
          "type": "array",
          "items": { "type": "string", "minLength": 1 }
        },
        "state_fields": {
          "type": "array",
          "minItems": 1,
          "items": { "type": "string", "minLength": 1 }
        }
      }
    },
    "source_refs": {
      "type": "object",
      "additionalProperties": false,
      "required": ["context_package_path", "battle_result_path", "run_state_before_path"],
      "properties": {
        "context_package_path": { "type": "string", "minLength": 1 },
        "battle_result_path": { "type": "string", "minLength": 1 },
        "run_state_before_path": { "type": "string", "minLength": 1 },
        "run_state_after_path": { "type": "string", "minLength": 1 }
      }
    },
    "world_state_delta_ref": {
      "type": "object",
      "additionalProperties": false,
      "required": ["path", "schema_version", "delta_id", "sha256"],
      "properties": {
        "path": { "type": "string", "minLength": 1 },
        "schema_version": {
          "type": "string",
          "const": "world_state_delta.v0.1"
        },
        "delta_id": { "type": "string", "minLength": 1 },
        "sha256": { "type": "string", "pattern": "^[0-9a-f]{64}$" }
      }
    },
    "preconditions": {
      "type": "array",
      "minItems": 1,
      "items": { "$ref": "#/$defs/precondition" }
    },
    "operation_effects_mapping": {
      "type": "array",
      "minItems": 1,
      "items": { "$ref": "#/$defs/operation_effect_mapping" }
    },
    "conflict_policy": {
      "type": "object",
      "additionalProperties": false,
      "required": ["mode", "conflict_keys"],
      "properties": {
        "mode": {
          "type": "string",
          "enum": ["reject_on_conflict", "merge_if_safe", "replace_if_newer"]
        },
        "conflict_keys": {
          "type": "array",
          "minItems": 1,
          "items": { "type": "string", "minLength": 1 }
        }
      }
    },
    "rollback_policy": {
      "type": "object",
      "additionalProperties": false,
      "required": ["mode", "inverse_operations_required", "notes"],
      "properties": {
        "mode": {
          "type": "string",
          "enum": ["inverse_operations", "required_snapshot", "non_reversible"]
        },
        "inverse_operations_required": { "type": "boolean" },
        "notes": { "type": "string", "minLength": 1 }
      }
    },
    "validation_report": {
      "type": "object",
      "additionalProperties": false,
      "required": [
        "gate_status",
        "world_delta_structure",
        "world_delta_semantics",
        "operation_mapping",
        "runtime_apply_checked",
        "warnings"
      ],
      "properties": {
        "gate_status": {
          "type": "string",
          "enum": ["passed", "warning", "failed"]
        },
        "world_delta_structure": {
          "type": "string",
          "enum": ["passed", "warning", "failed", "not_checked"]
        },
        "world_delta_semantics": {
          "type": "string",
          "enum": ["passed", "warning", "failed", "not_checked"]
        },
        "operation_mapping": {
          "type": "string",
          "enum": ["passed", "warning", "failed"]
        },
        "runtime_apply_checked": { "type": "boolean" },
        "warnings": {
          "type": "array",
          "items": { "type": "string", "minLength": 1 }
        }
      }
    },
    "status": {
      "type": "string",
      "enum": ["candidate", "validated", "committed", "rejected", "rolled_back"]
    },
    "expires_at": {
      "type": "string",
      "pattern": "^\\d{4}-\\d{2}-\\d{2}T\\d{2}:\\d{2}:\\d{2}(\\.\\d+)?(Z|[+-]\\d{2}:\\d{2})$"
    }
  },
  "$defs": {
    "precondition": {
      "type": "object",
      "additionalProperties": false,
      "required": ["kind", "ref", "summary"],
      "properties": {
        "kind": {
          "type": "string",
          "enum": ["run_state_version", "node_state", "resource_state", "flag_state", "artifact_available"]
        },
        "ref": { "type": "string", "minLength": 1 },
        "summary": { "type": "string", "minLength": 1 }
      }
    },
    "operation_effect_mapping": {
      "type": "object",
      "additionalProperties": false,
      "required": ["operation_index", "op", "target_ref", "effect_kind", "summary"],
      "properties": {
        "operation_index": { "type": "integer", "minimum": 0 },
        "op": { "type": "string", "minLength": 1 },
        "target_ref": { "type": "string", "minLength": 1 },
        "effect_kind": {
          "type": "string",
          "enum": [
            "phase_change",
            "map_node_patch",
            "resource_delta",
            "global_state_delta",
            "npc_relationship_delta",
            "fact_unlock",
            "sample_registration",
            "event_append",
            "flag_set",
            "task_upsert",
            "random_event_schedule",
            "research_job_upsert",
            "blueprint_unlock",
            "npc_introduction",
            "map_node_introduction"
          ]
        },
        "summary": { "type": "string", "minLength": 1 }
      }
    }
  }
}
