{
  "schema_version": "world_state_delta_transaction.v0.1",
  "transaction_id": "tx_stage_02_dawn_review_supply_line_001",
  "run_id": "run_demo_001",
  "worldbook_id": "long_night_lanterns",
  "actor": "system",
  "source": "narrative_event",
  "created_turn": 3,
  "created_at": "2026-07-02T00:00:00Z",
  "base_world_version": "run_demo_001:before_stage_02",
  "idempotency_key": "run_demo_001:delta_stage_02_dawn_review_supply_line",
  "scope": {
    "kind": "narrative_stage_commit",
    "node_ids": [
      "supply_line_hub_to_gray",
      "lamp_wick_store"
    ],
    "object_refs": [
      "phase:dawn_review_supply_line",
      "map_node:supply_line_hub_to_gray",
      "map_node:lamp_wick_store",
      "npc:npc_wire_mender_003",
      "resource:lantern_ash",
      "resource:lamp_shard",
      "resource:conductor_filament",
      "fact:refraction_snare_consumes_too_fast",
      "fact:wire_mender_candidate_seen",
      "task:task_repair_supply_line_hub",
      "task:task_prepare_wick_store_defense",
      "random_event:random_event_wick_store_pressure_hint",
      "research_job:research_signal_wick_decoy_trial",
      "event:dawn_review_supply_line_opened",
      "flag:stage_02_supply_line_review_completed"
    ],
    "state_fields": [
      "progress_phase",
      "map_nodes.supply_line_hub_to_gray",
      "map_nodes.lamp_wick_store",
      "npcs.npc_wire_mender_003",
      "resources.lantern_ash",
      "resources.lamp_shard",
      "resources.conductor_filament",
      "facts.refraction_snare_consumes_too_fast",
      "facts.wire_mender_candidate_seen",
      "tasks.task_repair_supply_line_hub",
      "tasks.task_prepare_wick_store_defense",
      "random_events.random_event_wick_store_pressure_hint",
      "research.jobs.research_signal_wick_decoy_trial",
      "events.dawn_review_supply_line_opened",
      "flags.stage_02_supply_line_review_completed"
    ]
  },
  "source_refs": {
    "context_package_path": "examples/review_packs/mvp_first_battle.context_package.json",
    "battle_result_path": "examples/world_deltas/stage_02_dawn_review_supply_line.world_delta.json",
    "run_state_before_path": "examples/run_world_states/demo_after_stage_01_gray_lantern.run_world_state.json",
    "run_state_after_path": "examples/run_world_states/demo_after_stage_02_dawn_review.run_world_state.json"
  },
  "world_state_delta_ref": {
    "path": "examples/world_deltas/stage_02_dawn_review_supply_line.world_delta.json",
    "schema_version": "world_state_delta.v0.1",
    "delta_id": "delta_stage_02_dawn_review_supply_line",
    "sha256": "cc49535782d0c0181d71a79a08e5a20458df224434cd44570e1c8fac2c8b9587"
  },
  "preconditions": [
    {
      "kind": "run_state_version",
      "ref": "run_demo_001:before_stage_02",
      "summary": "提交前使用 examples/run_world_states/demo_after_stage_01_gray_lantern.run_world_state.json 快照。"
    },
    {
      "kind": "artifact_available",
      "ref": "examples/world_deltas/stage_02_dawn_review_supply_line.world_delta.json",
      "summary": "来源产物已经生成并通过白名单 delta gate。"
    },
    {
      "kind": "node_state",
      "ref": "map_nodes.supply_line_hub_to_gray",
      "summary": "相关地图节点存在于提交前运行态或本次受控引入范围。"
    }
  ],
  "operation_effects_mapping": [
    {
      "operation_index": 0,
      "op": "set_progress_phase",
      "target_ref": "progress_phase",
      "effect_kind": "phase_change",
      "summary": "将 set_progress_phase 提交到受控运行态字段。"
    },
    {
      "operation_index": 1,
      "op": "introduce_map_node",
      "target_ref": "map_nodes.supply_line_hub_to_gray",
      "effect_kind": "map_node_introduction",
      "summary": "将 introduce_map_node 提交到受控运行态字段。"
    },
    {
      "operation_index": 2,
      "op": "introduce_map_node",
      "target_ref": "map_nodes.lamp_wick_store",
      "effect_kind": "map_node_introduction",
      "summary": "将 introduce_map_node 提交到受控运行态字段。"
    },
    {
      "operation_index": 3,
      "op": "introduce_npc",
      "target_ref": "npcs.npc_wire_mender_003",
      "effect_kind": "npc_introduction",
      "summary": "将 introduce_npc 提交到受控运行态字段。"
    },
    {
      "operation_index": 4,
      "op": "adjust_resource",
      "target_ref": "resources.lantern_ash",
      "effect_kind": "resource_delta",
      "summary": "将 adjust_resource 提交到受控运行态字段。"
    },
    {
      "operation_index": 5,
      "op": "adjust_resource",
      "target_ref": "resources.lamp_shard",
      "effect_kind": "resource_delta",
      "summary": "将 adjust_resource 提交到受控运行态字段。"
    },
    {
      "operation_index": 6,
      "op": "adjust_resource",
      "target_ref": "resources.conductor_filament",
      "effect_kind": "resource_delta",
      "summary": "将 adjust_resource 提交到受控运行态字段。"
    },
    {
      "operation_index": 7,
      "op": "unlock_fact",
      "target_ref": "facts.refraction_snare_consumes_too_fast",
      "effect_kind": "fact_unlock",
      "summary": "将 unlock_fact 提交到受控运行态字段。"
    },
    {
      "operation_index": 8,
      "op": "unlock_fact",
      "target_ref": "facts.wire_mender_candidate_seen",
      "effect_kind": "fact_unlock",
      "summary": "将 unlock_fact 提交到受控运行态字段。"
    },
    {
      "operation_index": 9,
      "op": "upsert_task",
      "target_ref": "tasks.task_repair_supply_line_hub",
      "effect_kind": "task_upsert",
      "summary": "将 upsert_task 提交到受控运行态字段。"
    },
    {
      "operation_index": 10,
      "op": "upsert_task",
      "target_ref": "tasks.task_prepare_wick_store_defense",
      "effect_kind": "task_upsert",
      "summary": "将 upsert_task 提交到受控运行态字段。"
    },
    {
      "operation_index": 11,
      "op": "schedule_random_event",
      "target_ref": "random_events.random_event_wick_store_pressure_hint",
      "effect_kind": "random_event_schedule",
      "summary": "将 schedule_random_event 提交到受控运行态字段。"
    },
    {
      "operation_index": 12,
      "op": "upsert_research_job",
      "target_ref": "research.jobs.research_signal_wick_decoy_trial",
      "effect_kind": "research_job_upsert",
      "summary": "将 upsert_research_job 提交到受控运行态字段。"
    },
    {
      "operation_index": 13,
      "op": "append_event",
      "target_ref": "events.dawn_review_supply_line_opened",
      "effect_kind": "event_append",
      "summary": "将 append_event 提交到受控运行态字段。"
    },
    {
      "operation_index": 14,
      "op": "set_flag",
      "target_ref": "flags.stage_02_supply_line_review_completed",
      "effect_kind": "flag_set",
      "summary": "将 set_flag 提交到受控运行态字段。"
    }
  ],
  "conflict_policy": {
    "mode": "reject_on_conflict",
    "conflict_keys": [
      "progress_phase",
      "map_nodes.supply_line_hub_to_gray",
      "map_nodes.lamp_wick_store",
      "npcs.npc_wire_mender_003",
      "resources.lantern_ash",
      "resources.lamp_shard",
      "resources.conductor_filament",
      "facts.refraction_snare_consumes_too_fast",
      "facts.wire_mender_candidate_seen",
      "tasks.task_repair_supply_line_hub",
      "tasks.task_prepare_wick_store_defense",
      "random_events.random_event_wick_store_pressure_hint",
      "research.jobs.research_signal_wick_decoy_trial",
      "events.dawn_review_supply_line_opened",
      "flags.stage_02_supply_line_review_completed"
    ]
  },
  "rollback_policy": {
    "mode": "required_snapshot",
    "inverse_operations_required": false,
    "notes": "v0.1 事务壳依赖提交前 RunWorldState 快照回滚，不生成通用逆向操作 DSL。"
  },
  "validation_report": {
    "gate_status": "passed",
    "world_delta_structure": "passed",
    "world_delta_semantics": "passed",
    "operation_mapping": "passed",
    "runtime_apply_checked": true,
    "warnings": [
      "source_refs.battle_result_path 是 v0.1 兼容字段；非战斗来源时指向对应来源 delta 产物。"
    ]
  },
  "status": "committed"
}
