{
  "schema_version": "world_state_delta_transaction.v0.1",
  "transaction_id": "tx_stage_05_old_signal_tower_pressure_001",
  "run_id": "run_demo_001",
  "worldbook_id": "long_night_lanterns",
  "actor": "system",
  "source": "narrative_event",
  "created_turn": 6,
  "created_at": "2026-07-02T00:00:00Z",
  "base_world_version": "run_demo_001:before_stage_05",
  "idempotency_key": "run_demo_001:delta_stage_05_old_signal_tower_pressure",
  "scope": {
    "kind": "narrative_stage_commit",
    "node_ids": [
      "old_signal_tower"
    ],
    "object_refs": [
      "phase:old_signal_tower_pressure_planned",
      "map_node:old_signal_tower",
      "random_event:random_event_old_signal_tower_pressure",
      "npc:npc_road_scout",
      "task:task_stabilize_old_signal_tower",
      "resource:glow_crystal",
      "sample:sample_resonant_glass_shard_trial",
      "research_job:research_echo_prism_relay_trial",
      "fact:old_signal_tower_resonance_measured",
      "random_event:random_event_signal_backwash",
      "event:old_signal_tower_pressure_planned",
      "flag:stage_05_old_signal_tower_pressure_planned"
    ],
    "state_fields": [
      "progress_phase",
      "map_nodes.old_signal_tower",
      "random_events.random_event_old_signal_tower_pressure",
      "npcs.npc_road_scout.relationship",
      "tasks.task_stabilize_old_signal_tower",
      "resources.glow_crystal",
      "research.temporary_samples.sample_resonant_glass_shard_trial",
      "research.jobs.research_echo_prism_relay_trial",
      "facts.old_signal_tower_resonance_measured",
      "random_events.random_event_signal_backwash",
      "events.old_signal_tower_pressure_planned",
      "flags.stage_05_old_signal_tower_pressure_planned",
      "global_state.pressure",
      "global_state.visibility",
      "global_state.hope"
    ]
  },
  "source_refs": {
    "context_package_path": "examples/review_packs/mvp_first_battle.context_package.json",
    "battle_result_path": "examples/world_deltas/stage_05_old_signal_tower_pressure.world_delta.json",
    "run_state_before_path": "examples/run_world_states/demo_after_stage_04_wick_store.run_world_state.json",
    "run_state_after_path": "examples/run_world_states/demo_after_stage_05_old_signal_tower.run_world_state.json"
  },
  "world_state_delta_ref": {
    "path": "examples/world_deltas/stage_05_old_signal_tower_pressure.world_delta.json",
    "schema_version": "world_state_delta.v0.1",
    "delta_id": "delta_stage_05_old_signal_tower_pressure",
    "sha256": "4ddf9bc02398afcf54318a23f16722785d3a8bee9ac482d49bcaab98eca13e41"
  },
  "preconditions": [
    {
      "kind": "run_state_version",
      "ref": "run_demo_001:before_stage_05",
      "summary": "提交前使用 examples/run_world_states/demo_after_stage_04_wick_store.run_world_state.json 快照。"
    },
    {
      "kind": "artifact_available",
      "ref": "examples/world_deltas/stage_05_old_signal_tower_pressure.world_delta.json",
      "summary": "来源产物已经生成并通过白名单 delta gate。"
    },
    {
      "kind": "node_state",
      "ref": "map_nodes.old_signal_tower",
      "summary": "相关地图节点存在于提交前运行态或本次受控引入范围。"
    }
  ],
  "operation_effects_mapping": [
    {
      "operation_index": 0,
      "op": "set_progress_phase",
      "target_ref": "progress_phase",
      "effect_kind": "phase_change",
      "summary": "将 set_progress_phase 提交到受控运行态字段。"
    },
    {
      "operation_index": 1,
      "op": "set_map_node_state",
      "target_ref": "map_nodes.old_signal_tower",
      "effect_kind": "map_node_patch",
      "summary": "将 set_map_node_state 提交到受控运行态字段。"
    },
    {
      "operation_index": 2,
      "op": "set_random_event_status",
      "target_ref": "random_events.random_event_old_signal_tower_pressure",
      "effect_kind": "random_event_schedule",
      "summary": "将 set_random_event_status 提交到受控运行态字段。"
    },
    {
      "operation_index": 3,
      "op": "update_npc_relationship",
      "target_ref": "npcs.npc_road_scout.relationship",
      "effect_kind": "npc_relationship_delta",
      "summary": "将 update_npc_relationship 提交到受控运行态字段。"
    },
    {
      "operation_index": 4,
      "op": "upsert_task",
      "target_ref": "tasks.task_stabilize_old_signal_tower",
      "effect_kind": "task_upsert",
      "summary": "将 upsert_task 提交到受控运行态字段。"
    },
    {
      "operation_index": 5,
      "op": "adjust_resource",
      "target_ref": "resources.glow_crystal",
      "effect_kind": "resource_delta",
      "summary": "将 adjust_resource 提交到受控运行态字段。"
    },
    {
      "operation_index": 6,
      "op": "add_temporary_sample",
      "target_ref": "research.temporary_samples.sample_resonant_glass_shard_trial",
      "effect_kind": "sample_registration",
      "summary": "将 add_temporary_sample 提交到受控运行态字段。"
    },
    {
      "operation_index": 7,
      "op": "upsert_research_job",
      "target_ref": "research.jobs.research_echo_prism_relay_trial",
      "effect_kind": "research_job_upsert",
      "summary": "将 upsert_research_job 提交到受控运行态字段。"
    },
    {
      "operation_index": 8,
      "op": "unlock_fact",
      "target_ref": "facts.old_signal_tower_resonance_measured",
      "effect_kind": "fact_unlock",
      "summary": "将 unlock_fact 提交到受控运行态字段。"
    },
    {
      "operation_index": 9,
      "op": "schedule_random_event",
      "target_ref": "random_events.random_event_signal_backwash",
      "effect_kind": "random_event_schedule",
      "summary": "将 schedule_random_event 提交到受控运行态字段。"
    },
    {
      "operation_index": 10,
      "op": "append_event",
      "target_ref": "events.old_signal_tower_pressure_planned",
      "effect_kind": "event_append",
      "summary": "将 append_event 提交到受控运行态字段。"
    },
    {
      "operation_index": 11,
      "op": "set_flag",
      "target_ref": "flags.stage_05_old_signal_tower_pressure_planned",
      "effect_kind": "flag_set",
      "summary": "将 set_flag 提交到受控运行态字段。"
    },
    {
      "operation_index": 12,
      "op": "adjust_global_state",
      "target_ref": "global_state.pressure",
      "effect_kind": "global_state_delta",
      "summary": "将 adjust_global_state 提交到受控运行态字段。"
    },
    {
      "operation_index": 13,
      "op": "adjust_global_state",
      "target_ref": "global_state.visibility",
      "effect_kind": "global_state_delta",
      "summary": "将 adjust_global_state 提交到受控运行态字段。"
    },
    {
      "operation_index": 14,
      "op": "adjust_global_state",
      "target_ref": "global_state.hope",
      "effect_kind": "global_state_delta",
      "summary": "将 adjust_global_state 提交到受控运行态字段。"
    }
  ],
  "conflict_policy": {
    "mode": "reject_on_conflict",
    "conflict_keys": [
      "progress_phase",
      "map_nodes.old_signal_tower",
      "random_events.random_event_old_signal_tower_pressure",
      "npcs.npc_road_scout.relationship",
      "tasks.task_stabilize_old_signal_tower",
      "resources.glow_crystal",
      "research.temporary_samples.sample_resonant_glass_shard_trial",
      "research.jobs.research_echo_prism_relay_trial",
      "facts.old_signal_tower_resonance_measured",
      "random_events.random_event_signal_backwash",
      "events.old_signal_tower_pressure_planned",
      "flags.stage_05_old_signal_tower_pressure_planned",
      "global_state.pressure",
      "global_state.visibility",
      "global_state.hope"
    ]
  },
  "rollback_policy": {
    "mode": "required_snapshot",
    "inverse_operations_required": false,
    "notes": "v0.1 事务壳依赖提交前 RunWorldState 快照回滚，不生成通用逆向操作 DSL。"
  },
  "validation_report": {
    "gate_status": "passed",
    "world_delta_structure": "passed",
    "world_delta_semantics": "passed",
    "operation_mapping": "passed",
    "runtime_apply_checked": true,
    "warnings": [
      "source_refs.battle_result_path 是 v0.1 兼容字段；非战斗来源时指向对应来源 delta 产物。"
    ]
  },
  "status": "committed"
}
